{
  "schema": "dkim2.exim-adapter-fixture.v1",
  "case_id": "exim-origin-deferred",
  "message_draft": "draft-ietf-dkim-dkim2-spec-04",
  "dns_draft": "draft-chuang-dkim2-dns-04",
  "class": "adapter_contract",
  "path": "transport_filter",
  "operation": "sign",
  "message_b64": "RnJvbTogc2VuZGVyQG9yaWdpbi5leGFtcGxlLnRlc3QNCg0K",
  "smtp": {
    "reverse_path_b64": "PHNlbmRlckBvcmlnaW4uZXhhbXBsZS50ZXN0Pg==",
    "forward_paths_b64": ["PHJlY2lwaWVudEByZWNlaXZlci5leGFtcGxlLnRlc3Q+"]
  },
  "expected": {
    "exim_outcome": "accept",
    "operation": "sign",
    "fidelity": "exim_transport_filter"
  },
  "evidence_state": "deferred"
}
